id,titill,staður,fasteign,lýsing,skýrslaid,fasteignid,active,
1,Gera kjarnaofn subcritical,Longyearbyen - Svalbarða,AA999-1,"OK-650VV kjarnaofninn er voru hannaðir um 1970. \nÞeir eiga það þó til að ofhitna ef þeim er ekki sint sem skyldi. \nReglulega (amk. 1 sinni í viku) þarf sáldra smá boron í kerfið.\nATH! Við þetta þarf verktaka sem á góðan gúmígalla því þetta er allt frekar blautt og heitt, og svo er ekki verra að vita eitthvað hvað maður er að gera.",1,2,True
2,Hengja upp jólaskraut,Longyearbyen - Svalbarða,AA999-1,"Þar sem hótelið er ekki að nýta öll 190 mega vöttin sem OK-650VV \ngetur búið til hefur verið ákv. að á hverju ári skuli sett upp \neinhver sú skrautlegasta jólaskrauts útstilling sem sögur fara af. \nSkal hefast handa við að hengja upp skrautið 1 nóv. ár hvert \nog svo aftur að taka það niður 10 jan. ár hvert.",2,2,True
3,Kæla niður snjóhús og stoppa í glufur.,Nuuk - Grænlandi,64-3900 - 64-3910,"Rétt yfir há sumartímann, frá 15 júlí til 25 ágúst, þarf að ditta \nað iGlú-ville húsunum (öllum). Aðalega þarf að bæta við snjó og \npassa að það sé ekki komin göt á veggi osfrv.",3,3,True
4,Slá og reita arfa af moldarhúsum.,Þórshöfn - Færeyjar,ix-9492 - ix-9502,"Yfir sumartímann þarf slá gras og reita arfa af moldrahúsunum amk. \neinusinni í viku. Gildir þetta frá 1 maí til 30 sept.",4,9,True
5,Gluggaþvottur,Allstaðar,"64-3875-6, 64-3831, 64-3812, ix-9331 - ix-9333, ix-2239, F959594","Einusinni í viku þarf að þrífa glugga á öllum ofantöldum fasteignum. \nÖll hús nema igloo; kafbáturinn og moldarhúsin, en ekkert af þeim \ner með glugga.",5,"1,4,5,6,7,8",True
6,Eyða,Nuuk,Skákið 15,kldskfjlsdjf,3,7,True
